{
  "$schema": "./.orchestrator.schema.json",
  "rulesFile": "project-rules.json",
  "bugsFile": "bugs.json",
  "ui": {
    "enableRoutes": true,
    "nextAppDir": "apps/web",
    "expressServerFile": "server/index.ts"
  },
  "cursor": {
    "manageCursorRules": true,
    "autoApprovePatterns": [
      "packages/orchestrator/**",
      ".progress/orchestrator/**"
    ]
  }
}

